start,end,speaker,text
0.0,3.640000000000015,R,The piece of heavy duty canvas.
4.341000000000008,8.861999999999995,C,I said yes but I wasn't sure. They could make a shelter out of it.
9.322000000000003,12.363,R,"Yeah that's true. The only thing is, is it quite heavy?"
12.38300000000001,18.045000000000016,C,"It is, but it provides shelter for everyone."
18.945999999999998,21.727000000000004,R,"Exactly, it keeps, okay, so will we put yes for that?"
21.766999999999996,22.546999999999997,C,We'll put yes for that.
22.628000000000014,24.147999999999996,R,"I put yes as well before,"
