start,end,speaker,text
0.0,0.4599999999999227,UNKNOWN,whiskey?
2.1409999999999627,4.661999999999921,R,"Aye, that was a null, a definite null. That was a definite, definite null."
6.842999999999961,9.683999999999969,C,"Brings your body temperature down, dehydrates you, not a good idea."
10.444999999999936,13.005999999999972,R,"Aye, basically it doesn't keep you warm, it just gets you piddled."
14.724999999999909,22.289999999999964,C,I can't imagine that would be a great idea when you're out in the freezing cold.
