start,end,speaker,text
0.0,2.1409999999999982,C,I said yes for a pistol as well.
2.761000000000003,18.609,R,"Yeah, same. Just, you know, useful in case there's an emergency. Probably likely to be something... Well, it's northern Canada, so... And it's in the forest, so there could be bears."
18.889000000000003,20.190000000000005,C,"Could be bears, and it's not very heavy either."
21.15,24.997000000000007,R,"No, no, it's not. It may be handed to someone who's trustworthy."
25.836999999999996,25.997000000000007,C,Yeah.
